{"authorization_basis":"Local training lab fixtures only; no live target authorized","exclusions":[],"included_assets":["file://labs/tenancy-demo/*"],"mode":"artifacts","permitted_methods":[],"policy_effective_date":"2026-09-15","policy_retrieved_at":"2026-09-15T00:00:00Z","policy_source":"local lab manifest labs/tenancy-demo/manifest.json","program_name":"Tenancy Demo Lab (local fixtures)","prohibited_methods":["GET","POST","PUT","PATCH","DELETE","HEAD","OPTIONS"],"request_budget":0,"testing_window":null,"unresolved_questions":[],"user_intent":"Practice T02.1 baseline/variant comparison on supplied artifacts"}
